{"$defs":{"binding":{"additionalProperties":true,"properties":{"from":{"enum":["input","literal","step","file","artifact"]},"input":{"type":"string"},"name":{"type":"string"},"path":{"type":"string"},"stepId":{"type":"string"},"value":{}},"required":["from"],"type":"object"},"delivery":{"additionalProperties":false,"properties":{"evidenceFields":{"items":{"type":"string"},"type":"array"},"files":{"items":{"oneOf":[{"type":"string"},{"additionalProperties":false,"properties":{"mediaType":{"type":"string"},"name":{"type":"string"}},"required":["name"],"type":"object"}]},"type":"array"},"requiredTools":{"items":{"type":"string"},"type":"array"},"schema":{"$ref":"#/$defs/jsonSchema"}},"type":"object"},"jsonSchema":{"description":"JSON Schema 2020-12 object; the runtime checks validity and rejects external or recursive $ref/$dynamicRef.","type":"object"},"node":{"additionalProperties":false,"properties":{"checkpoint":{"type":"boolean"},"code":{"type":"string"},"component":{"description":"Closed component snapshot validated by cd80.capability/1 snapshot contract.","type":"object"},"componentRef":{"additionalProperties":false,"properties":{"assetId":{"type":"string"},"versionId":{"type":"string"}},"required":["assetId","versionId"],"type":"object"},"delivery":{"$ref":"#/$defs/delivery"},"files":{"items":{"$ref":"#/$defs/resource"},"maxItems":512,"type":"array"},"id":{"pattern":"^[A-Za-z][A-Za-z0-9_-]{0,63}$","type":"string"},"inputBindings":{"additionalProperties":{"$ref":"#/$defs/binding"},"type":"object"},"kind":{"enum":["code","tool","skill"]},"provenance":{"type":"object"},"task":{"description":"Skill step task passed to the frozen Skill runner.","type":"string"},"title":{"type":"string"}},"required":["id","kind"],"type":"object"},"resource":{"additionalProperties":false,"oneOf":[{"not":{"required":["base64"]},"required":["text"]},{"not":{"required":["text"]},"required":["base64"]}],"properties":{"base64":{"contentEncoding":"base64","type":"string"},"path":{"minLength":1,"type":"string"},"text":{"type":"string"}},"required":["path"],"type":"object"},"testCase":{"additionalProperties":false,"properties":{"expectation":{"oneOf":[{"type":"null"},{"additionalProperties":false,"properties":{"mode":{"const":"json_equals"},"value":{}},"required":["mode","value"],"type":"object"},{"additionalProperties":false,"properties":{"mode":{"const":"fields"},"values":{"minProperties":1,"type":"object"}},"required":["mode","values"],"type":"object"}]},"fileBindings":{"additionalProperties":{"type":"string"},"type":"object"},"input":{"type":"object"},"label":{"maxLength":120,"minLength":1,"type":"string"}},"required":["label","input","fileBindings","expectation"],"type":"object"}},"$id":"https://cd80.local/contracts/cd80.app-2.schema.json","$schema":"https://json-schema.org/draft/2020-12/schema","additionalProperties":false,"description":"Canonical saved App definition. ZIP codeFile/resourceFiles and Python APP_INTERFACE are import transports and do not appear in saved definitions. Static issues may still require repair and verification before enablement.","properties":{"description":{"type":"string"},"format":{"const":"cd80.app/2"},"gaps":{"type":"array"},"inputSchema":{"$ref":"#/$defs/jsonSchema"},"name":{"maxLength":120,"minLength":1,"type":"string"},"nodes":{"items":{"$ref":"#/$defs/node"},"maxItems":64,"type":"array"},"outputs":{"additionalProperties":{"$ref":"#/$defs/binding"},"type":"object"},"parameterization":{"type":"array"},"rules":{"items":{"maxLength":4000,"type":"string"},"type":"array"},"source":{"type":"object"},"testCases":{"description":"Saved original task case first, followed by optional additional cases. A null expectation means an independent expected result is still required before verification.","items":{"$ref":"#/$defs/testCase"},"maxItems":10,"minItems":1,"type":"array"}},"required":["format","name","inputSchema","nodes","outputs"],"title":"cd80.app/2 portable application definition","type":"object"}
