{"description":"完整 APP 格式示例：接收两个数，输出它们的和。","format":"cd80.app/2","gaps":[],"inputSchema":{"additionalProperties":false,"properties":{"a":{"type":"number"},"b":{"type":"number"}},"required":["a","b"],"type":"object"},"name":"两数求和示例","nodes":[{"checkpoint":false,"code":"def run(payload):\n    return {\"sum\": payload[\"a\"] + payload[\"b\"]}\n","delivery":{"schema":{"properties":{"sum":{"type":"number"}},"required":["sum"],"type":"object"}},"files":[],"id":"sum","inputBindings":{"a":{"from":"input","path":"a"},"b":{"from":"input","path":"b"}},"kind":"code","title":"计算两数之和"}],"outputs":{"result":{"from":"step","path":"","stepId":"sum"}},"rules":["返回 a 与 b 的和。"],"testCases":[{"expectation":{"mode":"json_equals","value":{"result":{"sum":3}}},"fileBindings":{},"input":{"a":1,"b":2},"label":"原任务用例：1 + 2"}]}
